"Year","Team","Co-Drivers","Car","Class","Laps","Pos.","Class Pos."
"2010","United States Jaguar RSR","United States Paul Gentilozzi Belgium Marc Goossens","Jaguar XKR GT2","GT2","4","DNF","DNF"
"2012","United States Starworks Motorsport","Venezuela Enzo Potolicchio United Kingdom Tom Kimber-Smith","HPD ARX-03b","LMP2","354","7th","1st"
"2013","United States SRT Motorsports","Belgium Marc Goossens Germany Dominik Farnbacher","SRT Viper GTS-R","GTE Pro","306","24th","8th"
"2015","United States Extreme Speed Motorsports","United States Scott Sharp Denmark David Heinemeier Hansson","Ligier JS P2-Honda","LMP2","329","28th","10th"
"2016","United States Extreme Speed Motorsports","Canada Chris Cumming Brazil Pipo Derani","Ligier JS P2-Nissan","LMP2","291","42nd","16th"
