"Rank","Country","Athletes","Technical","Free","Total"
"","Russia","Anastasia Davydova, Mariya Gromova, Natalia Ishchenko, Elvira Khasyanova, Daria Korobova, Alexandra Patskevich, Svetlana Romashina, Angelika Timanina, Alla Shishkina","98.100","98.930","197.030"
"","China","Chang Si, Chen Xiaojun, Huang Xuechen, Jiang Tingting, Jiang Wenwen, Liu Ou, Luo Xi, Wu Yiwen, Sun Wenyan","97.000","97.010","194.010"
"","Spain","Clara Basiana, Alba Cabello, Ona Carbonell, Margalida Crespí, Andrea Fuentes, Thaïs Henríquez, Paula Klamburg, Irene Montrucchio, Laia Pons","96.200","96.920","193.120"
"4","Canada","Marie-Pier Boudreau Gagnon, Stéphanie Durocher, Jo-Annie Fortin, Chloé Isaac, Stéphanie Leclair, Tracy Little, Élise Marcotte, Valerie Welsh, Karine Thomas","94.400","95.230","189.630"
"5","Japan","Yumi Adachi, Aika Hakoyama, Yukiko Inui, Mayo Itoyama, Chisa Kobayashi, Risako Mitsui, Mariko Sakai, Kurumi Yoshida, Mai Nakamura","93.800","93.830","187.630"
"6","Great Britain","Katie Clark, Katie Dawkins, Olivia Allison, Jennifer Knobbs, Victoria Lucass, Asha Randall, Jenna Randall, Katie Skelton, Yvette Baker","87.300","88.140","175.440"
"7","Egypt","Reem Abdalazem, Shaza Abdelrahman, Nour El-Afandi, Dalia El-Gebaly, Samar Hassounah, Youmna Khallaf, Mai Mohamed, Mariam Omar, Aya Darwish","77.600","78.360","155.960"
"8","Australia","Eloise Amberger, Jenny-Lyn Anderson, Sarah Bombell, Olia Burtaev, Tamika Domrow, Bianca Hammett, Tarren Otte, Samantha Reid, Frankie Owen","77.500","77.430","154.930"
