"No","Party","Base State","Withdrawal Date","Reason for Withdrawal"
"1","Telangana Rashtra Samithi","Telangana","2006","Differences over proposed statehood for Telangana"
"2","Bahujan Samaj Party","National Party","2008","Congress opposed the UP government where the BSP was the ruling party"
"3","Communist Party of India (Marxist)","National Party","2008","Due to Indo-US nuclear deal."
"4","Communist Party of India","National Party","2008","Due to Indo-US nuclear deal"
"5","Jammu and Kashmir Peoples Democratic Party","Jammu and Kashmir","2009","Congress decided to support National Conference Government in Jammu and Kashmir"
"6","Pattali Makkal Katchi","Tamil Nadu","2009","PMK declared that it would join the AIADMK led front"
"7","All India Majlis-e-Ittehadul Muslimeen","Telangana","2012","Accused Congress led State Government of Communalism"
"8","All India Trinamool Congress","West Bengal","2012","TMC's demands on rollbacks and reforms not met, including the governments decision to allow FDI in retail"
"9","Socialist Janata (Democratic)","Kerala","2014","It merged with Janata Dal (United) on 29 December 2014."
