"No","Year","Film","Actors","Director","Language","Notes"
"1","2016","Sethupathi (2016)","Vijay Sethupathi, Remya Nambeesan, Vela Ramamoorthy","S. U Arunkumar","Tamil",""
"2","2017","Enakku Vaaitha Adimaigal","Jai, Pranitha, Karunakaran, Kaali Venkat, Naveen, Rajendran","Mahendran Rajamani","Tamil",""
"3","2017","Brindavanam","Arulnithi, Tanya Ravichandran, Vivek","Radha Mohan","Tamil",""
"4","2019","Sindhubaadh","Vijay Sethupathi, Anjali","S. U Arunkumar","Tamil",""
"5","2019","Maamanithan","Vijay Sethupathi, Gayathrie","Seenu Ramasamy","Tamil",""
